{
  "schema_version": 1,
  "id": "pipeline_sampler_repair_pickup",
  "family": "repair_pickup",
  "canvas_size": 768,
  "logical_size": [24, 24],
  "palette_path": ".agents/evidence/pixel-art/pipeline-sampler/palette/pixel-hangar-v1-sampler.png",
  "semantic_palette_path": ".agents/evidence/pixel-art/pipeline-sampler/palette/semantic-mask-v1-sampler.png",
  "transparent_color": "#FFFFFF",
  "layers": [
    {"id": "container", "mask_color": "#FF0000", "z": 0, "required": true},
    {"id": "repair_glyph", "mask_color": "#FFFF00", "z": 1, "required": true},
    {"id": "pickup_highlight", "mask_color": "#FF8000", "z": 2, "required": true}
  ],
  "pivot": [12, 12],
  "anchors": {"collection_center": [12, 12]},
  "frames": [
    {
      "id": "idle",
      "source_path": ".agents/evidence/pixel-art/pipeline-sampler/native/repair-pickup.png",
      "semantic_mask_path": ".agents/evidence/pixel-art/pipeline-sampler/masks/repair-pickup.png",
      "atlas_index": 0,
      "direction": 0,
      "state": "canonical"
    }
  ],
  "atlas": {"columns": 1, "padding": 0}
}
