{
  "schema_version": 1,
  "id": "pipeline_sampler_player_interceptor",
  "family": "player_chassis",
  "canvas_size": 512,
  "logical_size": [64, 64],
  "palette_path": ".agents/evidence/pixel-art/pipeline-sampler/palette/pixel-hangar-v1-sampler.png",
  "semantic_palette_path": ".agents/evidence/pixel-art/pipeline-sampler/palette/semantic-mask-v1-sampler.png",
  "transparent_color": "#FFFFFF",
  "layers": [
    {"id": "body", "mask_color": "#FF0000", "z": 0, "required": true},
    {"id": "left_wing", "mask_color": "#00FF00", "z": 1, "required": true},
    {"id": "right_wing", "mask_color": "#0000FF", "z": 2, "required": true},
    {"id": "cockpit", "mask_color": "#FFFF00", "z": 3, "required": true},
    {"id": "primary_mount", "mask_color": "#FF00FF", "z": 4, "required": true},
    {"id": "engine_line", "mask_color": "#00FFFF", "z": 5, "required": true}
  ],
  "pivot": [32, 32],
  "anchors": {
    "muzzle": [32, 8],
    "left_engine": [25, 55],
    "right_engine": [39, 55]
  },
  "frames": [
    {
      "id": "north",
      "source_path": ".agents/evidence/pixel-art/pipeline-sampler/raw/player-interceptor.png",
      "semantic_mask_path": ".agents/evidence/pixel-art/pipeline-sampler/masks/player-interceptor.png",
      "atlas_index": 0,
      "direction": 0,
      "state": "canonical"
    }
  ],
  "atlas": {"columns": 1, "padding": 0}
}
